{"applied":true,"authorization_reference":"HP-PROMPT-009/0.1.0","constitutional_authority":"NONE","counters_after":{"completed_designer_remediation_runs":0,"completed_targeted_closure_runs":1},"counters_before":{"completed_designer_remediation_runs":0,"completed_targeted_closure_runs":0},"evidence_semantics":"VALIDATED_TRANSITION_RECORD_NOT_RATIFICATION_OR_ROLE_EXECUTION_EVIDENCE","guards":{"blocking_finding_count":0,"blocking_finding_signature":"4f53cda18c2baa0c0354bb5f9a3ecbe5ed12ab4d8e11ba873c2f11161202b945","exhausted":[],"net_blocking_finding_reduction":null,"previous_blocking_finding_signature":null,"reopened_finding_ids":[],"repeated_finding_ids":[],"same_signature":false},"human_reviewed_repository_updates_required":["governance/ARTIFACT_REGISTRY.yaml","governance/CURRENT_STATE.md","governance/GOVERNANCE_MASTER_PLAN.md","source run manifest and validated package custody records"],"input":{"declared_role_result":"CLOSURE_CONFIRMED"},"loop":{"id":"GOV-LOOP-001","sha256":"cf7855a85d4ab9f3d4bb42c14ebbb0e735abcde938796f88284160904031fbe1","version":"0.1.0"},"next_mode":null,"next_role":null,"next_run_to_prepare":null,"package_validation_reference":"governance/reviews/phase-2-4-formal-result-import/kgr-005-import-validation-v0.1.0.yaml","previous_state":"TARGETED_CLOSURE_IN_PROGRESS","resulting_state":"CLOSURE_CONFIRMED","schema_version":"0.1.0","source_mode":"TARGETED_CLOSURE","source_role":"Kernel Adversary","source_run":"KGR-005"}
